id;name;status;address;city;state;zip;phone;contact;district_office;do_phone;license_no;Email Address;Website;Details;Services;Adoption Process
;Dillon International;Licensed;P.O. Box 1655;Grapevine;TX;76099;(972) 854-2935;;;;;joy@dillonadopt.com;https://www.dillonadopt.com/;Dillon International was founded by Jerry and Deniese Dillon in 1972 to meet the needs of the thousands of vulnerable Korean orphans. Centrally located in the United States, Dillon International is based in Tulsa, Oklahoma, and was the first licensed international adoption agency in the state. Throughout our history, Dillon International has been actively involved in establishing intercountry adoption standards and policies both in the United States and abroad. The agency has helped to establish adoption programs in several countries, including a model foster care program in Korea. Each participating country in the agency’s adoption program has invited Dillon International to help find homes for their vulnerable children. Since our beginning, Dillon International has placed over 6,000 children from developing countries with loving, adoptive families in the United States. Several hundred additional children have been placed with families in their country of birth as a result of Dillon’s efforts. In addition, Dillon International has helped to underwrite hospitals, orphanages and schools in Korea, India, China, and most recently in Vietnam.;Adoption;"APPLICATION: This allows our agency to get acquainted with your family and determine if your  family meets the requirements for our agency and the U.S. government. We will help you determine which intercountry programs you qualify for, since each of the foreign countries has varying requirements. PRE-ADOPTION WORKSHOP: This is a required online course that prepares your family for what to expect throughout the adoption process, with particular focus on country-specific family requirements  and procedures. This course must be completed prior to receiving the Home Study Application. HOME STUDY APPLICATION: This is a collection of documents and information about your family that is required based on state, U.S. and foreign government regulations. The application helps us get to know you better, assists the social worker’s preparation of the home study, and helps your family “rehearse” for dossier preparation. Criminal background and child abuse checks are initiated at this time. The Home Study Application cannot be processed until all requested documents and copies are received. U.S. CITIZEN & IMMIGRATION SERVICES: USCIS determines each family’s eligibility and suitability to adopt a child from a foreign country. The process begins with your family filing the I-600A application (non-Hague adoption) or the I-800A application (Hague adoption) with USCIS. We will provide your family with instructions for filing either form after Application Part 2 is approved. USCIS will inform your family of the location and date to have fingerprints taken for a FBI criminal background check. If approved, USCIS will send your family an approval notice. The I-600A is valid for 18 months; the I-800A is valid for 15 months. Your family must renew either form filed as many times as necessary to ensure the USCIS approval is valid at the time the child’s U.S. visa is issued. INTERNATIONAL ADOPTION SEMINAR: This provides your family an in-depth learning opportunity to explore issues relevant for intercountry adoption and adoptive families and helps your family build realistic expectations for both the adoption experience and the child joining your family.  Topics include: attachment, grief and loss, medical issues, impact of institutionalization and environment on child development, talking to your child about adoption, racial and cultural identity, initial adjustments and more. Your family must complete the seminar prior to completing your home study. Completion of the seminar helps fulfill the USCIS and Hague Treaty requirement for pre-adoption counseling and education. This is an online class available on www.dillonadopt.com. HOME STUDY: This is an evaluation of your family, which is requested after the Home Study Application has been approved. A social worker usually has two to four visits with your family, including a home visit to get to know you, your parenting styles, your resources, and your reasons for adopting. The intent of the home study is to assess your family’s readiness and suitability to adopt a child. The Home Study also helps educate and prepare your family for the adoption experience and the child joining your family. The social worker will submit a current home study in compliance with the require ments set up by your state of residence, U.S. government and the foreign country.  Our Agency will provide the social worker with guidelines for preparing your home study and will review your home study to ensure it complies with requirements. DOSSIER: Once your family’s home study is completed, your family will prepare a dossier for submission to the foreign country you have chosen (with the exception of Korea). The dossier is a set of legal documents, which includes your family’s home study and provides information, which helps foreign government officials in determining if your family meets the country’s requirements for adopting a child. We review your family’s dossier documents to ensure they meet country requirements. Depending on the country, our staff may also process the documents and obtain authentication or apostille certificates. CHILD REFERRAL: Our Agency receives information on a child from the foreign country. The child’s information is then presented to your family by your home study social worker or an agency representative. Referral information will include one or more photos of the child, a social and medical history on the child and any medical treatment records and birth family information available. Your family is given at least two weeks to carefully consider the child’s information and to have your physician and other medical specialists review the information before deciding whether to accept the referral of the child. CHILD ASSIGNMENT: This happens after your family accepts a referral of a specific child. Assignment paperwork is sent to the foreign country and the authorities there take the steps necessary for the adoption process to proceed forward. PARENTING EDUCATION: Parenting an adopted child can have unique joys and challenges. We require all adoptive parents to complete a series of education requirements, including several online adoption courses and recommended parenting books prior to receiving their child. Your family will receive the Parent Education Requirements checklist with the Home Study Application. CHILD ARRIVAL: This will depend on whether your family has selected to adopt from a country that allows children to be escorted to the U.S. or whether your family must travel to receive your child. We will notify you when your child is ready to come home and will provide preparation and guidance about travel. POST-PLACEMENT SUPERVISION. This is provided by your family’s home study provider. The first visit must be done within four weeks of your child’s arrival home. Your social worker will assess your family and child’s adjustments to each other and provide support to help with the transition. An additional two to ten visits will be made with your family over a six-month to five-year period, depending on the country. After a minimum of six months, your social worker can recommend the finalization (or re-finalization) of your child’s adoption in the U.S.  In addition, some countries require families to provide periodic update reports for several years after the adoption, sometimes until the child is 18 years old. ADOPTION FINALIZATION: Depending on the country, the adoption may be finalized in the child’s birth country or in the U.S.  Either way, it is important to have the adoption finalized, re-finalized, or recognized in a U.S. court.  We recommend that your family retains an attorney with intercountry adoption experience to assist you with this process and with obtaining a U.S. birth certificate for your child. U.S. CITIZENSHIP: This is the final step in the adoption process. If your child enters the U.S. on an IR4 or IH4 visa, you will submit Form N600 to USCIS to receive a Certificate of U.S. Citizenship for your child after the adoption is finalized in the U.S.  If your child enters the U.S. on a IR3 or IH3 visa, your family will automatically receive your child’s Certificate of U.S. Citizenship usually within 45 days of arriving home.  We require all families to obtain a Certificate of U.S. Citizenship for their child because the certificate is a non-expiring, irrefutable record of your child’s U.S. citizenship."
;Dillon International;Licensed;One First Missouri Center, Suite 115;Saint Louis;MO;63141;(314) 576-4100;;;;;DillonMO@dillonadopt.com;https://www.dillonadopt.com/;Dillon International was founded by Jerry and Deniese Dillon in 1972 to meet the needs of the thousands of vulnerable Korean orphans. Centrally located in the United States, Dillon International is based in Tulsa, Oklahoma, and was the first licensed international adoption agency in the state. Throughout our history, Dillon International has been actively involved in establishing intercountry adoption standards and policies both in the United States and abroad. The agency has helped to establish adoption programs in several countries, including a model foster care program in Korea. Each participating country in the agency’s adoption program has invited Dillon International to help find homes for their vulnerable children. Since our beginning, Dillon International has placed over 6,000 children from developing countries with loving, adoptive families in the United States. Several hundred additional children have been placed with families in their country of birth as a result of Dillon’s efforts. In addition, Dillon International has helped to underwrite hospitals, orphanages and schools in Korea, India, China, and most recently in Vietnam.;Adoption;"APPLICATION: This allows our agency to get acquainted with your family and determine if your  family meets the requirements for our agency and the U.S. government. We will help you determine which intercountry programs you qualify for, since each of the foreign countries has varying requirements. PRE-ADOPTION WORKSHOP: This is a required online course that prepares your family for what to expect throughout the adoption process, with particular focus on country-specific family requirements  and procedures. This course must be completed prior to receiving the Home Study Application. HOME STUDY APPLICATION: This is a collection of documents and information about your family that is required based on state, U.S. and foreign government regulations. The application helps us get to know you better, assists the social worker’s preparation of the home study, and helps your family “rehearse” for dossier preparation. Criminal background and child abuse checks are initiated at this time. The Home Study Application cannot be processed until all requested documents and copies are received. U.S. CITIZEN & IMMIGRATION SERVICES: USCIS determines each family’s eligibility and suitability to adopt a child from a foreign country. The process begins with your family filing the I-600A application (non-Hague adoption) or the I-800A application (Hague adoption) with USCIS. We will provide your family with instructions for filing either form after Application Part 2 is approved. USCIS will inform your family of the location and date to have fingerprints taken for a FBI criminal background check. If approved, USCIS will send your family an approval notice. The I-600A is valid for 18 months; the I-800A is valid for 15 months. Your family must renew either form filed as many times as necessary to ensure the USCIS approval is valid at the time the child’s U.S. visa is issued. INTERNATIONAL ADOPTION SEMINAR: This provides your family an in-depth learning opportunity to explore issues relevant for intercountry adoption and adoptive families and helps your family build realistic expectations for both the adoption experience and the child joining your family.  Topics include: attachment, grief and loss, medical issues, impact of institutionalization and environment on child development, talking to your child about adoption, racial and cultural identity, initial adjustments and more. Your family must complete the seminar prior to completing your home study. Completion of the seminar helps fulfill the USCIS and Hague Treaty requirement for pre-adoption counseling and education. This is an online class available on www.dillonadopt.com. HOME STUDY: This is an evaluation of your family, which is requested after the Home Study Application has been approved. A social worker usually has two to four visits with your family, including a home visit to get to know you, your parenting styles, your resources, and your reasons for adopting. The intent of the home study is to assess your family’s readiness and suitability to adopt a child. The Home Study also helps educate and prepare your family for the adoption experience and the child joining your family. The social worker will submit a current home study in compliance with the require ments set up by your state of residence, U.S. government and the foreign country.  Our Agency will provide the social worker with guidelines for preparing your home study and will review your home study to ensure it complies with requirements. DOSSIER: Once your family’s home study is completed, your family will prepare a dossier for submission to the foreign country you have chosen (with the exception of Korea). The dossier is a set of legal documents, which includes your family’s home study and provides information, which helps foreign government officials in determining if your family meets the country’s requirements for adopting a child. We review your family’s dossier documents to ensure they meet country requirements. Depending on the country, our staff may also process the documents and obtain authentication or apostille certificates. CHILD REFERRAL: Our Agency receives information on a child from the foreign country. The child’s information is then presented to your family by your home study social worker or an agency representative. Referral information will include one or more photos of the child, a social and medical history on the child and any medical treatment records and birth family information available. Your family is given at least two weeks to carefully consider the child’s information and to have your physician and other medical specialists review the information before deciding whether to accept the referral of the child. CHILD ASSIGNMENT: This happens after your family accepts a referral of a specific child. Assignment paperwork is sent to the foreign country and the authorities there take the steps necessary for the adoption process to proceed forward. PARENTING EDUCATION: Parenting an adopted child can have unique joys and challenges. We require all adoptive parents to complete a series of education requirements, including several online adoption courses and recommended parenting books prior to receiving their child. Your family will receive the Parent Education Requirements checklist with the Home Study Application. CHILD ARRIVAL: This will depend on whether your family has selected to adopt from a country that allows children to be escorted to the U.S. or whether your family must travel to receive your child. We will notify you when your child is ready to come home and will provide preparation and guidance about travel. POST-PLACEMENT SUPERVISION. This is provided by your family’s home study provider. The first visit must be done within four weeks of your child’s arrival home. Your social worker will assess your family and child’s adjustments to each other and provide support to help with the transition. An additional two to ten visits will be made with your family over a six-month to five-year period, depending on the country. After a minimum of six months, your social worker can recommend the finalization (or re-finalization) of your child’s adoption in the U.S.  In addition, some countries require families to provide periodic update reports for several years after the adoption, sometimes until the child is 18 years old. ADOPTION FINALIZATION: Depending on the country, the adoption may be finalized in the child’s birth country or in the U.S.  Either way, it is important to have the adoption finalized, re-finalized, or recognized in a U.S. court.  We recommend that your family retains an attorney with intercountry adoption experience to assist you with this process and with obtaining a U.S. birth certificate for your child. U.S. CITIZENSHIP: This is the final step in the adoption process. If your child enters the U.S. on an IR4 or IH4 visa, you will submit Form N600 to USCIS to receive a Certificate of U.S. Citizenship for your child after the adoption is finalized in the U.S.  If your child enters the U.S. on a IR3 or IH3 visa, your family will automatically receive your child’s Certificate of U.S. Citizenship usually within 45 days of arriving home.  We require all families to obtain a Certificate of U.S. Citizenship for their child because the certificate is a non-expiring, irrefutable record of your child’s U.S. citizenship."
;Chosen Child Adoption Services;;501 Pine Tree Road, Suite G-2;Longview;TX;75604;(214) 383-3551;;;;;;http://www.chosenchildtx.org/;The mission of Chosen Child Adoption Services is to place children in Christ-centered homes. We believe that God uses adoption as part of His plans to build families and to provide hope and ministry to birth parents, adoptive parents, and adopted children. Chosen Child Adoption Services exists to minister in love while spreading the Gospel of Jesus Christ to a hurting world. We recognize that the opportunity to reach the world begins with the willingness to meet the world at the point of its deepest need. The ministries of Chosen Child Adoption Services are directed toward providing Christ-centered solutions to the problems that confront our society daily, specifically the crisis of unplanned pregnancy. Perhaps nowhere is the need for a Christ-centered solution greater than in the area of adoption services. This is a ministry that will reach the world for Christ for generations to come, operating as an evangelical, Christian, non-profit agency providing a non-discriminatory pricing structure to adoptive parents. Our goal is to keep the cost of adoption an affordable reality for Christian families. Chosen Child Adoption Services heavily subsidizes the various ministries of the agency through individual donations and volunteer support. Chosen Child Adoption Services is committed to following the biblical principles of stewardship and financial management and seeks to publicize, promote, and present the adoption alternative to as many people as possible. The adoption process can provide a time of redirection, healing, forgiveness, and resolution to all parties involved if it is carried out with these goals in mind. Our goal, as a full-service professional agency, is to minister to each member of the adoption triad, while providing everything he or she will need to promote a positive and healthy emotional, physical, and spiritual future. A lack of accessible information regarding the adoption process has been an obstacle for far too long. By utilizing the avenues of relationship building, advertising, networking, and prayer, our hope is that all women facing an unplanned pregnancy will at the very least take time to consider adoption as a viable alternative, rather than to dismiss it completely.;Adoption Services;
;FamilyLink Kids at Legacy Ranch;Licensed;13326 N Highway 183;Gonzales;TX;78629;(830) 875-6062;;;;;;http://www.legacyranchkids.com/;"FamilyLink Kids at Legacy Ranch is a non-profit Licensed Foster Care and Adoption agency that works directly with Child Protective Services to find homes for children who have been abused, neglected or exploited. We founded FamilyLink because, as foster and adoptive parents ourselves; we recognized the incredible need for safe and loving foster or adoptive homes for these children. God has a great purpose and destiny for each of them but they need a family for that to be accomplished. Day and night we receive calls, “Do you have a home for a newborn, 1, 5, 10, 13 yr old pregnant teen…?” There is reimbursement for foster care; insurance is provided, as well as free adoptions and state college tuition! Are you, or someone you know, interested in becoming a foster or adoptive parent? Becoming a mentor/volunteer or child advocate? We are also available to share at your church or community meeting/event on behalf of the children. Please spread the word and help us in our cause of finding great homes for these children. In an effort to further help these children, we have established Legacy Ranch, a weekend retreat and summer camp. Our goal is to help replace the heritage of abandonment, abuse and neglect with a legacy of hope, love and destiny. We have more weekend retreats coming up soon. During our retreats we have art therapy, sports, sibling reunification and one-on-one time with mentors, all of which makes a huge impact.";Foster Care and Adoption;
;Catholic Charities of Dallas - Pregnancy & Adoption Services;Licensed;2323 N. Walton Walker Blvd.;Dallas;TX;75212;(214) 526-2772;;;;;;http://www.catholiccharitiesdallas.org/;"Committed to choosing life, nurturing children, and strengthening families, we provides services that: Guide women with unplanned pregnancies through making healthy choices;  Offer educational parenting resources and assistance; Provide services to help facilitate adoption for birth mothers and adoptive families. Pregnancy & Adoption Services has been a well-respected licensed child placing agency since 1985. Our Pregnancy and Adoption Services staff believes in a child-centered approach by building healthy families, strengthening parenting and promoting openness in adoption. Our staff provides experienced counselors to assist pregnancy clients to explore their pro-life options and provide information and resources to make informed decisions. In addition to assistance to expectant women, the program provides 40+ years of child-placing experience to waiting adoptive families.";"Infant Adoption Program: Home study services, Matching expectant birth parents with prospective adoptive parents, Adoption finalization, Post-placement services; Finally Home Program; Pregnancy Services: One-on-one support, Material assistance, Parenting classes, Options counseling;  Parenting Services Program: Budgeting, One-on-one support, Parenting classes, Material assistance (diapers, baby clothes, formula, maternity clothes, etc.), Resources for childbirth, child support, child care and legal rights and responsibilities";
;Providence Place - Adoption Services;Licensed;6487 Whitby Road;San Antonio;TX;78240;(800) 842-5433;;;;;info@provplace.org;http://www.provplace.org/;Since 1895, we’ve provided adoption services to expectant mothers and families. Adoption is a loving alternative that provides opportunities for everyone involved.;"Birth Mother Services; Infant Adoption; International Adoption; Older Child Adoption; Embryo Adoption; Post-Adoption Services: Match database registry, Search, Document Request, Communication & Information Exchange ";
